from,name,subject,message
jimenez@wsc2024.local,Adele Jimenez,TSHOOT Ticket 1,"What animal can produce as much heat as 4800 degrees Celsisus?
"
dominguez@wsc2024.local,Rooney Dominguez,TSHOOT Ticket 2,"What flavor is the ""mystery"" flavor of Dum Dums?"
page@wsc2024.local,Roary Page,TSHOOT Ticket 3,Why is Facebook's color scheme blue?
martinez@wsc2024.local,Craig Martinez,TSHOOT Ticket 4,"After the U.S. president and vice president, what position is the next highest-paid federal government employee?"
moss@wsc2024.local,Brendan Moss,TSHOOT Ticket 5,Which individual has the highest total earnings from an American game show?